filename,test_name,test_id,issue_severity,issue_confidence,issue_cwe,issue_text,line_number,col_offset,end_col_offset,line_range,more_info
./codeSpace/fixed2\CWE-020-codeql_4.py,flask_debug_true,B201,HIGH,MEDIUM,https://cwe.mitre.org/data/definitions/94.html,"A Flask app appears to be run with debug=True, which exposes the Werkzeug debugger and allows the execution of arbitrary code.",25,4,23,[25],https://bandit.readthedocs.io/en/1.7.8/plugins/b201_flask_debug_true.html
./codeSpace/fixed2\CWE-022-author_2.py,blacklist,B310,MEDIUM,HIGH,https://cwe.mitre.org/data/definitions/22.html,Audit url open for permitted schemes. Allowing use of file:/ or custom schemes is often unexpected.,20,9,29,[20],https://bandit.readthedocs.io/en/1.7.8/blacklists/blacklist_calls.html#b310-urllib-urlopen
./codeSpace/fixed2\CWE-078-author_1.py,blacklist,B404,LOW,HIGH,https://cwe.mitre.org/data/definitions/78.html,Consider possible security implications associated with the subprocess module.,1,0,17,[1],https://bandit.readthedocs.io/en/1.7.8/blacklists/blacklist_imports.html#b404-import-subprocess
./codeSpace/fixed2\CWE-078-author_1.py,subprocess_without_shell_equals_true,B603,LOW,HIGH,https://cwe.mitre.org/data/definitions/78.html,subprocess call - check for execution of untrusted input.,21,17,79,[21],https://bandit.readthedocs.io/en/1.7.8/plugins/b603_subprocess_without_shell_equals_true.html
./codeSpace/fixed2\CWE-078-codeql_1.py,blacklist,B404,LOW,HIGH,https://cwe.mitre.org/data/definitions/78.html,Consider possible security implications associated with the subprocess module.,2,0,17,[2],https://bandit.readthedocs.io/en/1.7.8/blacklists/blacklist_imports.html#b404-import-subprocess
./codeSpace/fixed2\CWE-078-codeql_1.py,subprocess_without_shell_equals_true,B603,LOW,HIGH,https://cwe.mitre.org/data/definitions/78.html,subprocess call - check for execution of untrusted input.,20,18,109,[20],https://bandit.readthedocs.io/en/1.7.8/plugins/b603_subprocess_without_shell_equals_true.html
./codeSpace/fixed2\CWE-094-author_1.py,exec_used,B102,MEDIUM,HIGH,https://cwe.mitre.org/data/definitions/78.html,Use of exec detected.,25,8,65,[25],https://bandit.readthedocs.io/en/1.7.8/plugins/b102_exec_used.html
