"Uncontrolled data used in path expression","Accessing paths influenced by users can allow an attacker to access unexpected resources.","error","This path depends on a [[""user-provided value""|""relative:///CWE-022-codeql_1.py:1:26:1:32""]].","/CWE-022-codeql_1.py","23","23","23","30"
"Code injection","Interpreting unsanitized user input as code allows a malicious user to perform arbitrary code execution.","error","This code execution depends on a [[""user-provided value""|""relative:///CWE-094-author_1.py:1:26:1:32""]].","/CWE-094-author_1.py","30","23","30","67"
"Flask app is run in debug mode","Running a Flask app in debug mode may allow an attacker to run arbitrary code through the Werkzeug debugger.","error","A Flask app appears to be run in debug mode. This may allow an attacker to run arbitrary code through the debugger.","/CWE-094-author_1.py","56","5","56","23"
"URL redirection from remote source","URL redirection based on unvalidated user input may cause redirection to malicious web sites.","error","Untrusted URL redirection depends on a [[""user-provided value""|""relative:///CWE-020-codeql_3.py:1:36:1:42""]].","/CWE-020-codeql_3.py","21","25","21","30"
"URL redirection from remote source","URL redirection based on unvalidated user input may cause redirection to malicious web sites.","error","Untrusted URL redirection depends on a [[""user-provided value""|""relative:///CWE-020-codeql_4.py:1:36:1:42""]].","/CWE-020-codeql_4.py","10","25","10","34"
"URL redirection from remote source","URL redirection based on unvalidated user input may cause redirection to malicious web sites.","error","Untrusted URL redirection depends on a [[""user-provided value""|""relative:///CWE-601-codeql_1.py:1:26:1:32""]].","/CWE-601-codeql_1.py","15","25","15","32"
