"Uncontrolled data used in path expression","Accessing paths influenced by users can allow an attacker to access unexpected resources.","error","This path depends on a [[""user-provided value""|""relative:///CWE-116-author_1.py:2:29:2:35""]].","/CWE-116-author_1.py","26","72","26","85"
"Uncontrolled data used in path expression","Accessing paths influenced by users can allow an attacker to access unexpected resources.","error","This path depends on a [[""user-provided value""|""relative:///CWE-116-author_1.py:2:29:2:35""]].","/CWE-116-author_1.py","31","28","31","41"
"Uncontrolled command line","Using externally controlled strings in a command line may allow a malicious user to change the meaning of the command.","error","This command line depends on a [[""user-provided value""|""relative:///CWE-078-codeql_1.py:1:26:1:32""]].","/CWE-078-codeql_1.py","25","41","25","53"
"Flask app is run in debug mode","Running a Flask app in debug mode may allow an attacker to run arbitrary code through the Werkzeug debugger.","error","A Flask app appears to be run in debug mode. This may allow an attacker to run arbitrary code through the debugger.","/CWE-116-author_1.py","38","5","38","23"
"URL redirection from remote source","URL redirection based on unvalidated user input may cause redirection to malicious web sites.","error","Untrusted URL redirection depends on a [[""user-provided value""|""relative:///CWE-020-codeql_3.py:1:36:1:42""]].","/CWE-020-codeql_3.py","17","25","17","34"
"URL redirection from remote source","URL redirection based on unvalidated user input may cause redirection to malicious web sites.","error","Untrusted URL redirection depends on a [[""user-provided value""|""relative:///CWE-020-codeql_4.py:1:36:1:42""]].","/CWE-020-codeql_4.py","14","25","14","34"
"Regular expression injection","User input should not be used in regular expressions without first being escaped, otherwise a malicious user may be able to inject an expression that could require exponential time on certain inputs.","error","This regular expression depends on a [[""user-provided value""|""relative:///CWE-730-codeql_1.py:1:26:1:32""]] and is executed by [[""re.search""|""relative:///CWE-730-codeql_1.py:20:12:20:35""]].","/CWE-730-codeql_1.py","20","22","20","28"
