filename,test_name,test_id,issue_severity,issue_confidence,issue_cwe,issue_text,line_number,col_offset,end_col_offset,line_range,more_info
./codeSpace/fixed2\CWE-022-author_2.py,blacklist,B310,MEDIUM,HIGH,https://cwe.mitre.org/data/definitions/22.html,Audit url open for permitted schemes. Allowing use of file:/ or custom schemes is often unexpected.,16,15,35,[16],https://bandit.readthedocs.io/en/1.7.8/blacklists/blacklist_calls.html#b310-urllib-urlopen
./codeSpace/fixed2\CWE-078-author_1.py,blacklist,B404,LOW,HIGH,https://cwe.mitre.org/data/definitions/78.html,Consider possible security implications associated with the subprocess module.,1,0,17,[1],https://bandit.readthedocs.io/en/1.7.8/blacklists/blacklist_imports.html#b404-import-subprocess
./codeSpace/fixed2\CWE-078-author_1.py,subprocess_without_shell_equals_true,B603,LOW,HIGH,https://cwe.mitre.org/data/definitions/78.html,subprocess call - check for execution of untrusted input.,16,8,43,[16],https://bandit.readthedocs.io/en/1.7.8/plugins/b603_subprocess_without_shell_equals_true.html
./codeSpace/fixed2\CWE-078-codeql_1.py,blacklist,B404,LOW,HIGH,https://cwe.mitre.org/data/definitions/78.html,Consider possible security implications associated with the subprocess module.,2,0,17,[2],https://bandit.readthedocs.io/en/1.7.8/blacklists/blacklist_imports.html#b404-import-subprocess
./codeSpace/fixed2\CWE-078-codeql_1.py,subprocess_without_shell_equals_true,B603,LOW,HIGH,https://cwe.mitre.org/data/definitions/78.html,subprocess call - check for execution of untrusted input.,22,17,111,[22],https://bandit.readthedocs.io/en/1.7.8/plugins/b603_subprocess_without_shell_equals_true.html
./codeSpace/fixed2\CWE-611-sonar_3.py,blacklist,B410,LOW,HIGH,https://cwe.mitre.org/data/definitions/20.html,Using XSLT to parse untrusted XML data is known to be vulnerable to XML attacks. Replace XSLT with the equivalent defusedxml package.,2,0,27,[2],https://bandit.readthedocs.io/en/1.7.8/blacklists/blacklist_imports.html#b410-import-lxml
./codeSpace/fixed2\CWE-776-codeql_1.py,blacklist,B405,LOW,HIGH,https://cwe.mitre.org/data/definitions/20.html,"Using xml.etree.ElementTree to parse untrusted XML data is known to be vulnerable to XML attacks. Replace xml.etree.ElementTree with the equivalent defusedxml package, or make sure defusedxml.defuse_stdlib() is called.",2,0,34,[2],https://bandit.readthedocs.io/en/1.7.8/blacklists/blacklist_imports.html#b405-import-xml-etree
./codeSpace/fixed2\CWE-776-codeql_1.py,blacklist,B314,MEDIUM,HIGH,https://cwe.mitre.org/data/definitions/20.html,Using xml.etree.ElementTree.XMLParser to parse untrusted XML data is known to be vulnerable to XML attacks. Replace xml.etree.ElementTree.XMLParser with its defusedxml equivalent function or make sure defusedxml.defuse_stdlib() is called,22,17,31,[22],https://bandit.readthedocs.io/en/1.7.8/blacklists/blacklist_calls.html#b313-b320-xml-bad-elementtree
./codeSpace/fixed2\CWE-776-codeql_1.py,blacklist,B314,MEDIUM,HIGH,https://cwe.mitre.org/data/definitions/20.html,Using xml.etree.ElementTree.fromstring to parse untrusted XML data is known to be vulnerable to XML attacks. Replace xml.etree.ElementTree.fromstring with its defusedxml equivalent function or make sure defusedxml.defuse_stdlib() is called,24,15,57,[24],https://bandit.readthedocs.io/en/1.7.8/blacklists/blacklist_calls.html#b313-b320-xml-bad-elementtree
